{"schema_version":1,"id":"dynamic-esm-bundle","description":"Literal dynamic import and hashed chunk graph candidate.","profile":"dynamic-module-bundler-output","evidence_level":"behavioral","support_tier":"candidate","claims":["literal-dynamic-import-discovery","hashed-chunk-graph","modulepreload-discovery"],"scenarios":[{"id":"home","path":"/index.html","wait_for":{"selector":"#status"},"checks":[{"id":"boot","type":"text","selector":"#status","equals":"boot-ready"}],"actions":[{"type":"click","selector":"#load"}],"post_action_checks":[{"id":"dynamic","type":"attribute","selector":"#status","name":"data-dynamic","equals":"ready"}]}]}
